{
  "schemaVersion": 1,
  "id": "series_000055",
  "names": {
    "ja": "義父に犯されて・・・ 美嫁いぢり",
    "zh-CN": "被公公侵犯……美丽媳妇玩弄",
    "en": "Violated by Her Father-in-Law... Beautiful Bride Torment"
  },
  "aliases": {
    "ja": [],
    "zh-CN": [],
    "en": []
  },
  "makerId": "maker_000005",
  "status": "unknown",
  "officialWebsite": "https://madonna-av.com/works/list/series/1548",
  "externalIds": {
    "madonna.series": "1548"
  },
  "firstPublishedIn": "0.4.6"
}
