{
  "schemaVersion": 1,
  "id": "series_000022",
  "names": {
    "ja": "淫乱奴隷の強制快楽",
    "zh-CN": "淫乱奴隶的强制快感",
    "en": "Forced Pleasure of a Lewd Slave"
  },
  "aliases": {
    "ja": [],
    "zh-CN": [],
    "en": []
  },
  "makerId": "maker_000004",
  "status": "unknown",
  "officialWebsite": "https://attackers.net/works/list/series/2258",
  "externalIds": {
    "attackers.series": "2258"
  },
  "firstPublishedIn": "0.4.5"
}
