{
  "schemaVersion": 1,
  "id": "series_000093",
  "names": {
    "ja": "濡れ透け婦人の甘い疼き",
    "zh-CN": "湿透夫人的甜蜜悸动",
    "en": "Sweet Throbbing of a Soaked-Through Lady"
  },
  "aliases": {
    "ja": [],
    "zh-CN": [],
    "en": []
  },
  "makerId": "maker_000005",
  "status": "unknown",
  "officialWebsite": "https://madonna-av.com/works/list/series/1588",
  "externalIds": {
    "madonna.series": "1588"
  },
  "firstPublishedIn": "0.4.7"
}
