{
  "schemaVersion": 1,
  "id": "series_000019",
  "names": {
    "ja": "夫の目の前で犯されて",
    "zh-CN": "在丈夫面前被侵犯",
    "en": "Violated Before Her Husband’s Eyes"
  },
  "aliases": {
    "ja": [],
    "zh-CN": [],
    "en": []
  },
  "makerId": "maker_000004",
  "status": "unknown",
  "officialWebsite": "https://attackers.net/works/list/series/2254",
  "externalIds": {
    "attackers.series": "2254"
  },
  "firstPublishedIn": "0.4.5"
}
