{
  "schemaVersion": 1,
  "id": "series_000083",
  "names": {
    "ja": "働くおばさん!",
    "zh-CN": "工作的熟女！",
    "en": "Working Mature Woman!"
  },
  "aliases": {
    "ja": [],
    "zh-CN": [],
    "en": []
  },
  "makerId": "maker_000005",
  "status": "unknown",
  "officialWebsite": "https://madonna-av.com/works/list/series/1570",
  "externalIds": {
    "madonna.series": "1570"
  },
  "firstPublishedIn": "0.4.7"
}
