{
  "schemaVersion": 1,
  "id": "series_000033",
  "names": {
    "ja": "五十路熟女18人4時間",
    "zh-CN": "五十岁熟女18人4小时",
    "en": "18 Mature Women in Their 50s, 4 Hours"
  },
  "aliases": {
    "ja": [],
    "zh-CN": [],
    "en": []
  },
  "makerId": "maker_000005",
  "status": "unknown",
  "officialWebsite": "https://madonna-av.com/works/list/series/1555",
  "externalIds": {
    "madonna.series": "1555"
  },
  "firstPublishedIn": "0.4.5"
}
