{
  "schemaVersion": 1,
  "id": "series_000029",
  "names": {
    "ja": "愛する夫の目の前で・・・",
    "zh-CN": "在深爱的丈夫面前……",
    "en": "Before Her Beloved Husband..."
  },
  "aliases": {
    "ja": [],
    "zh-CN": [],
    "en": []
  },
  "makerId": "maker_000005",
  "status": "unknown",
  "officialWebsite": "https://madonna-av.com/works/list/series/1551",
  "externalIds": {
    "madonna.series": "1551"
  },
  "firstPublishedIn": "0.4.5"
}
