{
  "schemaVersion": 1,
  "id": "series_000099",
  "names": {
    "ja": "義母の舌と接吻",
    "zh-CN": "继母的舌与接吻",
    "en": "Kissing with My Mother-in-Law's Tongue"
  },
  "aliases": {
    "ja": [],
    "zh-CN": [],
    "en": []
  },
  "makerId": "maker_000005",
  "status": "unknown",
  "officialWebsite": "https://madonna-av.com/works/list/series/1594",
  "externalIds": {
    "madonna.series": "1594"
  },
  "firstPublishedIn": "0.4.7"
}
